{
  "schema_version": "geotarget.problem/v1",
  "plugin_locks": [
    {
      "plugin_id": "11111111-1111-4111-8111-111111111111/fixture",
      "version": "1.2.3",
      "core_abi": "1.0.0",
      "content_hash": "sha256:aaaaaaaaaaaaaaaaaaaaaaaaaaaaaaaaaaaaaaaaaaaaaaaaaaaaaaaaaaaaaaaa"
    }
  ],
  "variables": [
    {
      "id": "x",
      "type_id": "11111111-1111-4111-8111-111111111111/fixture::Real",
      "origin": 0,
      "scale": 2,
      "lower": -10,
      "upper": 10
    }
  ],
  "graph": [
    {"kind": "reference", "id": "x_ref", "variable": "x"},
    {
      "kind": "literal",
      "id": "zero",
      "type_id": "11111111-1111-4111-8111-111111111111/fixture::Real",
      "value": 0
    },
    {
      "kind": "call",
      "id": "equation",
      "operation": "11111111-1111-4111-8111-111111111111/fixture::equal",
      "args": ["x_ref", "zero"],
      "kwargs": {}
    },
    {
      "kind": "literal",
      "id": "guard_margin",
      "type_id": "11111111-1111-4111-8111-111111111111/fixture::Real",
      "value": 1
    },
    {
      "kind": "literal",
      "id": "domain_margin",
      "type_id": "11111111-1111-4111-8111-111111111111/fixture::Real",
      "value": 1
    },
    {
      "kind": "call",
      "id": "target_value",
      "operation": "11111111-1111-4111-8111-111111111111/fixture::target_value",
      "args": ["x_ref"],
      "kwargs": {}
    }
  ],
  "relations": [{"node": "equation", "scale_override": 2}],
  "guards": [{"node": "guard_margin", "strict": true, "scale_override": 1}],
  "domains": [{"node": "domain_margin", "strict": false}],
  "target": "target_value"
}
